09:58:46.523860 eth1  In  IP 100.64.0.1.45166 > 100.65.0.2.4789: VXLAN, flags [I] (0x08), vni 100
IP 192.168.10.1.56780 > 192.170.8.0.80: Flags [S], seq 2994458736, win 56760, options [mss 9460,sackOK,TS val 3976154687 ecr 0,nop,wscale 7], length 0
09:58:46.523874 vni100 P   IP 192.168.10.1.56780 > 192.170.8.0.80: Flags [S], seq 2994458736, win 56760, options [mss 9460,sackOK,TS val 3976154687 ecr 0,nop,wscale 7], length 0
09:58:46.523877 br100 In  IP 192.168.10.1.56780 > 192.170.8.0.80: Flags [S], seq 2994458736, win 56760, options [mss 9460,sackOK,TS val 3976154687 ecr 0,nop,wscale 7], length 0
09:58:46.523882 frrns Out IP 192.168.10.1.56780 > 192.170.8.0.80: Flags [S], seq 2994458736, win 56760, options [mss 9460,sackOK,TS val 3976154687 ecr 0,nop,wscale 7], length 0
09:58:46.523922 frrns In  IP 192.170.8.0.80 > 192.168.10.1.56780: Flags [S.], seq 2643824723, ack 2994458737, win 65160, options [mss 1460,sackOK,TS val 3204394780 ecr 3976154687,nop,wscale 7], length 0
09:58:46.523925 br100 Out IP 192.170.8.0.80 > 192.168.10.1.56780: Flags [S.], seq 2643824723, ack 2994458737, win 65160, options [mss 1460,sackOK,TS val 3204394780 ecr 3976154687,nop,wscale 7], length 0
09:58:46.523927 vni100 Out IP 192.170.8.0.80 > 192.168.10.1.56780: Flags [S.], seq 2643824723, ack 2994458737, win 65160, options [mss 1460,sackOK,TS val 3204394780 ecr 3976154687,nop,wscale 7], length 0
09:58:46.523930 eth1  Out IP 100.65.0.2.42196 > 100.64.0.1.4789: VXLAN, flags [I] (0x08), vni 100
IP 192.170.8.0.80 > 192.168.10.1.56780: Flags [S.], seq 2643824723, ack 2994458737, win 65160, options [mss 1460,sackOK,TS val 3204394780 ecr 3976154687,nop,wscale 7], length 0
09:58:46.523976 eth1  In  IP 100.64.0.1.45166 > 100.65.0.2.4789: VXLAN, flags [I] (0x08), vni 100
IP 192.168.10.1.56780 > 192.170.8.0.80: Flags [.], ack 1, win 444, options [nop,nop,TS val 3976154687 ecr 3204394780], length 0
09:58:46.523980 vni100 P   IP 192.168.10.1.56780 > 192.170.8.0.80: Flags [.], ack 1, win 444, options [nop,nop,TS val 3976154687 ecr 3204394780], length 0
09:58:46.523981 br100 In  IP 192.168.10.1.56780 > 192.170.8.0.80: Flags [.], ack 1, win 444, options [nop,nop,TS val 3976154687 ecr 3204394780], length 0
09:58:46.523983 frrns Out IP 192.168.10.1.56780 > 192.170.8.0.80: Flags [.], ack 1, win 444, options [nop,nop,TS val 3976154687 ecr 3204394780], length 0
09:58:46.524227 eth1  In  IP 100.64.0.1.45166 > 100.65.0.2.4789: VXLAN, flags [I] (0x08), vni 100
IP 192.168.10.1.56780 > 192.170.8.0.80: Flags [P.], seq 1:76, ack 1, win 444, options [nop,nop,TS val 3976154688 ecr 3204394780], length 75: HTTP: GET / HTTP/1.1
09:58:46.524232 vni100 P   IP 192.168.10.1.56780 > 192.170.8.0.80: Flags [P.], seq 1:76, ack 1, win 444, options [nop,nop,TS val 3976154688 ecr 3204394780], length 75: HTTP: GET / HTTP/1.1
09:58:46.524233 br100 In  IP 192.168.10.1.56780 > 192.170.8.0.80: Flags [P.], seq 1:76, ack 1, win 444, options [nop,nop,TS val 3976154688 ecr 3204394780], length 75: HTTP: GET / HTTP/1.1
09:58:46.524235 frrns Out IP 192.168.10.1.56780 > 192.170.8.0.80: Flags [P.], seq 1:76, ack 1, win 444, options [nop,nop,TS val 3976154688 ecr 3204394780], length 75: HTTP: GET / HTTP/1.1
09:58:46.524264 frrns In  IP 192.170.8.0.80 > 192.168.10.1.56780: Flags [.], ack 76, win 509, options [nop,nop,TS val 3204394781 ecr 3976154688], length 0
09:58:46.524268 br100 Out IP 192.170.8.0.80 > 192.168.10.1.56780: Flags [.], ack 76, win 509, options [nop,nop,TS val 3204394781 ecr 3976154688], length 0
09:58:46.524269 vni100 Out IP 192.170.8.0.80 > 192.168.10.1.56780: Flags [.], ack 76, win 509, options [nop,nop,TS val 3204394781 ecr 3976154688], length 0
09:58:46.524272 eth1  Out IP 100.65.0.2.42196 > 100.64.0.1.4789: VXLAN, flags [I] (0x08), vni 100
IP 192.170.8.0.80 > 192.168.10.1.56780: Flags [.], ack 76, win 509, options [nop,nop,TS val 3204394781 ecr 3976154688], length 0
09:58:46.524881 frrns In  IP 192.170.8.0.80 > 192.168.10.1.56780: Flags [P.], seq 1:7241, ack 76, win 509, options [nop,nop,TS val 3204394781 ecr 3976154688], length 7240: HTTP: HTTP/1.1 403 Forbidden
09:58:46.524892 br100 Out IP 192.170.8.0.80 > 192.168.10.1.56780: Flags [P.], seq 1:7241, ack 76, win 509, options [nop,nop,TS val 3204394781 ecr 3976154688], length 7240: HTTP: HTTP/1.1 403 Forbidden
09:58:46.524896 vni100 Out IP 192.170.8.0.80 > 192.168.10.1.56780: Flags [P.], seq 1:7241, ack 76, win 509, options [nop,nop,TS val 3204394781 ecr 3976154688], length 7240: HTTP: HTTP/1.1 403 Forbidden
09:58:46.524917 eth1  Out IP 100.65.0.2.42196 > 100.64.0.1.4789: VXLAN, flags [I] (0x08), vni 100
IP 192.170.8.0.80 > 192.168.10.1.56780: Flags [.], seq 1:1449, ack 76, win 509, options [nop,nop,TS val 3204394781 ecr 3976154688], length 1448: HTTP: HTTP/1.1 403 Forbidden
09:58:46.524918 eth1  Out IP 100.65.0.2.42196 > 100.64.0.1.4789: VXLAN, flags [I] (0x08), vni 100
IP 192.170.8.0.80 > 192.168.10.1.56780: Flags [.], seq 1449:2897, ack 76, win 509, options [nop,nop,TS val 3204394781 ecr 3976154688], length 1448: HTTP
09:58:46.524918 eth1  Out IP 100.65.0.2.42196 > 100.64.0.1.4789: VXLAN, flags [I] (0x08), vni 100
IP 192.170.8.0.80 > 192.168.10.1.56780: Flags [.], seq 2897:4345, ack 76, win 509, options [nop,nop,TS val 3204394781 ecr 3976154688], length 1448: HTTP
09:58:46.524919 eth1  Out IP 100.65.0.2.42196 > 100.64.0.1.4789: VXLAN, flags [I] (0x08), vni 100
IP 192.170.8.0.80 > 192.168.10.1.56780: Flags [.], seq 4345:5793, ack 76, win 509, options [nop,nop,TS val 3204394781 ecr 3976154688], length 1448: HTTP
09:58:46.524919 eth1  Out IP 100.65.0.2.42196 > 100.64.0.1.4789: VXLAN, flags [I] (0x08), vni 100
IP 192.170.8.0.80 > 192.168.10.1.56780: Flags [P.], seq 5793:7241, ack 76, win 509, options [nop,nop,TS val 3204394781 ecr 3976154688], length 1448: HTTP
09:58:46.525009 eth1  In  IP 100.64.0.1.45166 > 100.65.0.2.4789: VXLAN, flags [I] (0x08), vni 100
IP 192.168.10.1.56780 > 192.170.8.0.80: Flags [.], ack 1449, win 433, options [nop,nop,TS val 3976154688 ecr 3204394781], length 0
09:58:46.525013 eth1  In  IP 100.64.0.1.45166 > 100.65.0.2.4789: VXLAN, flags [I] (0x08), vni 100
IP 192.168.10.1.56780 > 192.170.8.0.80: Flags [.], ack 7241, win 389, options [nop,nop,TS val 3976154688 ecr 3204394781], length 0
09:58:46.525013 eth1  In  IP 100.64.0.1.45166 > 100.65.0.2.4789: VXLAN, flags [I] (0x08), vni 100
IP 192.168.10.1.56780 > 192.170.8.0.80: Flags [.], ack 2897, win 422, options [nop,nop,TS val 3976154688 ecr 3204394781], length 0
09:58:46.525016 vni100 P   IP 192.168.10.1.56780 > 192.170.8.0.80: Flags [.], ack 1449, win 433, options [nop,nop,TS val 3976154688 ecr 3204394781], length 0
09:58:46.525017 br100 In  IP 192.168.10.1.56780 > 192.170.8.0.80: Flags [.], ack 1449, win 433, options [nop,nop,TS val 3976154688 ecr 3204394781], length 0
09:58:46.525018 vni100 P   IP 192.168.10.1.56780 > 192.170.8.0.80: Flags [.], ack 7241, win 389, options [nop,nop,TS val 3976154688 ecr 3204394781], length 0
09:58:46.525019 br100 In  IP 192.168.10.1.56780 > 192.170.8.0.80: Flags [.], ack 7241, win 389, options [nop,nop,TS val 3976154688 ecr 3204394781], length 0
09:58:46.525020 frrns Out IP 192.168.10.1.56780 > 192.170.8.0.80: Flags [.], ack 1449, win 433, options [nop,nop,TS val 3976154688 ecr 3204394781], length 0
09:58:46.525021 vni100 P   IP 192.168.10.1.56780 > 192.170.8.0.80: Flags [.], ack 2897, win 422, options [nop,nop,TS val 3976154688 ecr 3204394781], length 0
09:58:46.525021 br100 In  IP 192.168.10.1.56780 > 192.170.8.0.80: Flags [.], ack 2897, win 422, options [nop,nop,TS val 3976154688 ecr 3204394781], length 0
09:58:46.525022 frrns Out IP 192.168.10.1.56780 > 192.170.8.0.80: Flags [.], ack 7241, win 389, options [nop,nop,TS val 3976154688 ecr 3204394781], length 0
09:58:46.525023 frrns Out IP 192.168.10.1.56780 > 192.170.8.0.80: Flags [.], ack 2897, win 422, options [nop,nop,TS val 3976154688 ecr 3204394781], length 0
09:58:46.525042 frrns In  IP 192.170.8.0.80 > 192.168.10.1.56780: Flags [.], seq 7241:8689, ack 76, win 509, options [nop,nop,TS val 3204394781 ecr 3976154688], length 1448: HTTP
09:58:46.525044 br100 Out IP 192.170.8.0.80 > 192.168.10.1.56780: Flags [.], seq 7241:8689, ack 76, win 509, options [nop,nop,TS val 3204394781 ecr 3976154688], length 1448: HTTP
09:58:46.525045 vni100 Out IP 192.170.8.0.80 > 192.168.10.1.56780: Flags [.], seq 7241:8689, ack 76, win 509, options [nop,nop,TS val 3204394781 ecr 3976154688], length 1448: HTTP
09:58:46.525048 eth1  Out IP 100.65.0.2.42196 > 100.64.0.1.4789: VXLAN, flags [I] (0x08), vni 100
IP 192.170.8.0.80 > 192.168.10.1.56780: Flags [.], seq 7241:8689, ack 76, win 509, options [nop,nop,TS val 3204394781 ecr 3976154688], length 1448: HTTP
09:58:46.525072 eth1  In  IP 100.64.0.1.45166 > 100.65.0.2.4789: VXLAN, flags [I] (0x08), vni 100
IP 192.168.10.1.56780 > 192.170.8.0.80: Flags [.], ack 8689, win 378, options [nop,nop,TS val 3976154688 ecr 3204394781], length 0
09:58:46.525075 vni100 P   IP 192.168.10.1.56780 > 192.170.8.0.80: Flags [.], ack 8689, win 378, options [nop,nop,TS val 3976154688 ecr 3204394781], length 0
09:58:46.525076 br100 In  IP 192.168.10.1.56780 > 192.170.8.0.80: Flags [.], ack 8689, win 378, options [nop,nop,TS val 3976154688 ecr 3204394781], length 0
09:58:46.525078 frrns Out IP 192.168.10.1.56780 > 192.170.8.0.80: Flags [.], ack 8689, win 378, options [nop,nop,TS val 3976154688 ecr 3204394781], length 0
09:58:46.525114 frrns In  IP 192.170.8.0.80 > 192.168.10.1.56780: Flags [P.], seq 8689:8748, ack 76, win 509, options [nop,nop,TS val 3204394782 ecr 3976154688], length 59: HTTP
09:58:46.525117 br100 Out IP 192.170.8.0.80 > 192.168.10.1.56780: Flags [P.], seq 8689:8748, ack 76, win 509, options [nop,nop,TS val 3204394782 ecr 3976154688], length 59: HTTP
09:58:46.525118 vni100 Out IP 192.170.8.0.80 > 192.168.10.1.56780: Flags [P.], seq 8689:8748, ack 76, win 509, options [nop,nop,TS val 3204394782 ecr 3976154688], length 59: HTTP
09:58:46.525122 eth1  Out IP 100.65.0.2.42196 > 100.64.0.1.4789: VXLAN, flags [I] (0x08), vni 100
IP 192.170.8.0.80 > 192.168.10.1.56780: Flags [P.], seq 8689:8748, ack 76, win 509, options [nop,nop,TS val 3204394782 ecr 3976154688], length 59: HTTP
09:58:46.525156 eth1  In  IP 100.64.0.1.45166 > 100.65.0.2.4789: VXLAN, flags [I] (0x08), vni 100
IP 192.168.10.1.56780 > 192.170.8.0.80: Flags [.], ack 8748, win 378, options [nop,nop,TS val 3976154689 ecr 3204394782], length 0
09:58:46.525161 vni100 P   IP 192.168.10.1.56780 > 192.170.8.0.80: Flags [.], ack 8748, win 378, options [nop,nop,TS val 3976154689 ecr 3204394782], length 0
09:58:46.525162 br100 In  IP 192.168.10.1.56780 > 192.170.8.0.80: Flags [.], ack 8748, win 378, options [nop,nop,TS val 3976154689 ecr 3204394782], length 0
09:58:46.525165 frrns Out IP 192.168.10.1.56780 > 192.170.8.0.80: Flags [.], ack 8748, win 378, options [nop,nop,TS val 3976154689 ecr 3204394782], length 0
09:58:46.525324 eth1  In  IP 100.64.0.1.45166 > 100.65.0.2.4789: VXLAN, flags [I] (0x08), vni 100
IP 192.168.10.1.56780 > 192.170.8.0.80: Flags [F.], seq 76, ack 8748, win 378, options [nop,nop,TS val 3976154689 ecr 3204394782], length 0
09:58:46.525330 vni100 P   IP 192.168.10.1.56780 > 192.170.8.0.80: Flags [F.], seq 76, ack 8748, win 378, options [nop,nop,TS val 3976154689 ecr 3204394782], length 0
09:58:46.525332 br100 In  IP 192.168.10.1.56780 > 192.170.8.0.80: Flags [F.], seq 76, ack 8748, win 378, options [nop,nop,TS val 3976154689 ecr 3204394782], length 0
09:58:46.525335 frrns Out IP 192.168.10.1.56780 > 192.170.8.0.80: Flags [F.], seq 76, ack 8748, win 378, options [nop,nop,TS val 3976154689 ecr 3204394782], length 0
09:58:46.525770 frrns In  IP 192.170.8.0.80 > 192.168.10.1.56780: Flags [F.], seq 8748, ack 77, win 509, options [nop,nop,TS val 3204394782 ecr 3976154689], length 0
09:58:46.525787 br100 Out IP 192.170.8.0.80 > 192.168.10.1.56780: Flags [F.], seq 8748, ack 77, win 509, options [nop,nop,TS val 3204394782 ecr 3976154689], length 0
09:58:46.525799 vni100 Out IP 192.170.8.0.80 > 192.168.10.1.56780: Flags [F.], seq 8748, ack 77, win 509, options [nop,nop,TS val 3204394782 ecr 3976154689], length 0
09:58:46.525816 eth1  Out IP 100.65.0.2.42196 > 100.64.0.1.4789: VXLAN, flags [I] (0x08), vni 100
IP 192.170.8.0.80 > 192.168.10.1.56780: Flags [F.], seq 8748, ack 77, win 509, options [nop,nop,TS val 3204394782 ecr 3976154689], length 0
09:58:46.525892 eth1  In  IP 100.64.0.1.45166 > 100.65.0.2.4789: VXLAN, flags [I] (0x08), vni 100
IP 192.168.10.1.56780 > 192.170.8.0.80: Flags [.], ack 8749, win 378, options [nop,nop,TS val 3976154689 ecr 3204394782], length 0
09:58:46.525896 vni100 P   IP 192.168.10.1.56780 > 192.170.8.0.80: Flags [.], ack 8749, win 378, options [nop,nop,TS val 3976154689 ecr 3204394782], length 0
09:58:46.525897 br100 In  IP 192.168.10.1.56780 > 192.170.8.0.80: Flags [.], ack 8749, win 378, options [nop,nop,TS val 3976154689 ecr 3204394782], length 0
09:58:46.525900 frrns Out IP 192.168.10.1.56780 > 192.170.8.0.80: Flags [.], ack 8749, win 378, options [nop,nop,TS val 3976154689 ecr 3204394782], length 0

